{
  "schema_version": 1,
  "id": "custom-home-intake",
  "version": 1,
  "title": "Custom Home Planning",
  "description": "Sample domain pack demonstrating the engine contract; no home-building behavior belongs in the runtime.",
  "status": "draft",
  "locale": "en-CA",
  "topics_file": "topics.json",
  "question_files": [
    "questions/project.json",
    "questions/site.json",
    "questions/household.json",
    "questions/structure.json",
    "questions/rooms.json",
    "questions/style.json",
    "questions/outdoors.json",
    "questions/budget.json"
  ],
  "component_catalog": "../../../components/catalog.v1.json",
  "contract": "../../../contracts/v1/definition.schema.json",
  "metadata": {
    "sample_domain": true,
    "question_count": 28,
    "clarification_followup_limit": 2
  }
}
